{
  "profileId": "MS1",
  "description": "Minimum mandatory metric set for all benchmark and validation runs. The profile fixes the canonical client-side and cluster-side metrics that must always be collected or derivable from run artifacts.",
  "clientMetrics": [
    "request_count",
    "success_rate_percent",
    "failure_count",
    "mean_response_time_ms",
    "p50_response_time_ms",
    "p95_response_time_ms",
    "p99_response_time_ms",
    "throughput_rps"
  ],
  "clusterMetrics": [
    "node_cpu_percent",
    "node_memory_percent",
    "pod_cpu_millicores",
    "pod_memory_mib",
    "pod_placement",
    "pod_restart_count",
    "pod_readiness"
  ],
  "metricSetManifestSuffix": "_metric-set.json",
  "metricSetTextSuffix": "_metric-set.txt"
}
